{
  "$schema": "https://json-schema.org/draft/2020-12/schema",
  "type": "object",
  "required": [
    "id",
    "modelName",
    "organisation",
    "modelStatus",
    "aiTask",
    "inputSpecification",
    "outputSpecification",
    "architecture",
    "trainingDataOrigin",
    "primaryPerformanceMetric",
    "license",
    "accessLink",
    "moreInformation"
  ],
  "properties": {
    "id": { "type": "string" },
    "modelName": { "type": "string" },
    "organisation": { "type": "string" },
    "modelStatus": { "type": "string" },
    "aiTask": { "type": "string" },
    "inputSpecification": { "type": "string" },
    "outputSpecification": { "type": "string" },
    "architecture": { "type": "string" },
    "trainingDataOrigin": { "type": "string" },
    "primaryPerformanceMetric": { "type": "string" },
    "license": { "type": "string" },
    "accessLink": { "type": "string" },
    "moreInformation": { "type": "string" },
    "lastUpdated": {
      "type": "string",
      "description": "Set automatically by the approval workflow on every add/update; not submitter-provided."
    }
  },
  "additionalProperties": false
}
