{
  "id": "model-002",
  "modelName": "Buildings detection model",
  "organisation": "Lantmäteriet",
  "modelStatus": "In production",
  "aiTask": "Object detection",
  "inputSpecification": "The model requires true orthos and a normalised elevation model in tiff format. Input images must be of size 512x512 pixels. Orthos must be provided as a 4-channel image with 25 cm resolution.",
  "outputSpecification": "The model outputs a classified raster with the same spatial resolution as the input imagery. Each pixel is assigned a value 1 or 0 (building – not building). The output preserves the input coordinate reference system.",
  "architecture": "Segformer",
  "trainingDataOrigin": "True orthophotos (0.25 cm) and normalised elevation model.",
  "primaryPerformanceMetric": "F-score: 95%.",
  "license": "Model not available for external use",
  "accessLink": "N/A",
  "moreInformation": "N/A This model is in production",
  "lastUpdated": "2026-09-09T08:02:41.777Z"
}
