{
  "id": "model-010",
  "modelName": "YOLO-based Transport Network Detection",
  "organisation": "IGN Spain",
  "modelStatus": "Validated",
  "aiTask": "Object detection",
  "inputSpecification": "High-resolution PNOA imagery at 0.15 m resolution is referenced. Exact format, CRS, tiling, and preprocessing steps are not specified.",
  "outputSpecification": "Detected transport features such as road markings, arrows, roundabouts, and bridges. Output schema and confidence scores are not specified.",
  "architecture": "YOLOv5 / YOLOv8",
  "trainingDataOrigin": "PNOA imagery for Spain. Dataset structure, labeling process, and availability are not specified.",
  "primaryPerformanceMetric": "Not stated in the source.",
  "license": "Not stated in the source.",
  "accessLink": "Not stated in the source.",
  "moreInformation": "Used for transport network maintenance and cartographic updates."
}
