{
  "id": "n-testmodell",
  "modelName": "Testmodell",
  "organisation": "N/A",
  "modelStatus": "N/A",
  "aiTask": "N/A",
  "inputSpecification": "N/A",
  "outputSpecification": "N/A",
  "architecture": "N/A",
  "trainingDataOrigin": "N/A",
  "primaryPerformanceMetric": "N/A",
  "license": "N/A",
  "accessLink": "N/A",
  "moreInformation": "N/A"
}
