{
  "id": "model-001",
  "modelName": "Land Cover Classification (Sentinel-2)",
  "organisation": "Esri",
  "modelStatus": "Production ready",
  "aiTask": "Semantic segmentation",
  "inputSpecification": "Sentinel-2 imagery, 10m, EPSG:3857.",
  "outputSpecification": "Raster with CLC 2018 classes.",
  "architecture": "U-Net",
  "trainingDataOrigin": "CORINE Land Cover 2018.",
  "primaryPerformanceMetric": "Overall accuracy 84%.",
  "license": "Esri Master License Agreement",
  "accessLink": "https://www.arcgis.com/home/item.html?id=afd124844ba84da69c2c533d4af10a58",
  "moreInformation": "Source: Esri Living Atlas (model entry)."
}
