{
  "id": "model-005",
  "modelName": "YOLOv8 Road Asset Detection for 3D Mapping",
  "organisation": "Cyclomedia",
  "modelStatus": "Validated",
  "aiTask": "Object detection",
  "inputSpecification": "Used within Cyclomedia 3D mapping workflows. Exact sensor types, formats, spatial resolution, and preprocessing steps are not specified.",
  "outputSpecification": "Detected road assets and defects for infrastructure assessment. Output schema, geometry type, and confidence scores are not specified.",
  "architecture": "YOLOv8",
  "trainingDataOrigin": "Not explicitly stated. Likely based on proprietary outdoor environment data captured by Cyclomedia, but this is not formally specified in the source.",
  "primaryPerformanceMetric": "Not stated in the source.",
  "license": "Not stated in the source.",
  "accessLink": "Not stated in the source.",
  "moreInformation": "Part of Cyclomedia Insights 360 platform for infrastructure and municipal applications."
}
